Title,Year,Stars,Director,Genre
30 Years to Life,2001,"Erika Alexander, Melissa De Sousa, Tracy Morgan",Vanessa Middleton,Comedy
35 and Ticking,2011,"Tamala Jones, Nicole Ari Parker, Kevin Hart",Russ Parr,Comedy
48 Hrs,1982,"Nick Nolte, Eddie Murphy, Annette O’Toole",Walter Hill,Comedy
A Family Thing,1996,"Robert Duvall, James Earl Jones, Michael Beach",Richard Pearce,Comedy
A Low Down Dirty Shame,1994,"Keenen Ivory Wayans, Charles S. Dutton, Jada Pinkett Smith",Keenen Ivory Wayans,Comedy
A Piece of the Action,1977,"Sidney Poitier, Bill Cosby, James Earl Jones",Sidney Poitier,Comedy
A Thin Line Between Love and Hate,1996,"Martin Lawrence, Lynn Whitfield, Regina King",Martin Lawrence,Comedy
A Thousand Words,2012,"Eddie Murphy, Cliff Curtis, Kerry Washington",Brian Robbins,Comedy
Aaron Loves Angela,1975,"Moses Gunn, Kevin Hooks, Irene Cara",Gordon Parks Jr.,Comedy
Adios Amigo,1976,"Fred Williamson, Richard Pryor, James Brown",Fred Williamson,Comedy
All About You,2001,"Renee Goldsberry, Terron Brooks, Debbie Allen",Christine Swanson,Comedy
Amazing Grace,1974,"Moms Mabley, Slappy White, Rosalind Cash",Stan Lathan,Comedy
Are We Done Yet?,2007,"Ice Cube, Nia Long, John C. McGinleyh",Steve Carr,Comedy
Are We There Yet?,2005,"Ice Cube, Nia Long, Aleisha Allen",Brian LeVant,Comedy
B.A.P.S.,1997,"Halle Berry, Natalie Desselle, Martin Landau",Robert Townsend,Comedy
Baby Boy,2001,"AlexSandra Wright, Tyrese Gibson, Taraji P. Henson",John Singleton,Comedy
Bad Boys,1995,"Will Smith, Martin Lawrence, Lisa Boyle",Michael Bay,Comedy
Bad Boys II,2003,"Will Smith, Martin Lawrence, Gabrielle Union",Michael Bay,Comedy
Bamboozled,2000,"Damon Wayans, Savion Glover, Jada Pinkett Smith",Spike Lee,Comedy
Barbershop,2002,"Ice Cube, Cedric the Entertainer, Eve",Tim Story,Comedy
Barbershop 2: Back in Business,2004,"Ice Cube, Cedric the Entertainer, Eve",Kevin Rodney Sullivan,Comedy
Beauty Shop,2005,"Queen Latifah, Alicia Silverstone, Djimon Hounsou",Bille Woodruff,Comedy
Bebe's Kids,1992,"Faizon Love, Vanessa Bell Calloway, Wayne Collins Jr.",Bruce W. Smith,Comedy
Beverly Hills Cop,1984,"Eddie Murphy, Judge Reinhold, John Ashton",Martin Brest,Comedy
Big Momma’s House,2000,"Martin Lawrence, Nia Long, Paul Giamatti",Raja Gosnell,Comedy
Big Momma’s House 2,2006,"Martin Lawrence, Emily Procter, Nia Long",John Whitesell,Comedy
Bingo Long Traveling All-Stars and Motor Kings,1976,"Billy Dee Williams, James Earl Jones, Richard Pryor",John Badham,Comedy
Black Belt Jones,1974,"Jim Kelly, Gloria Hendry, Scatman Crothers",Robert Clouse,Comedy
Black Dynamite,2009,"Arsenio Hall, Tommy Davidson, Michael Jai White",Scott Sanders,Comedy
Blankman,1994,"Damon Wayans, David Alan Grier, Robin Givens",Mike Binder,Comedy
Blue Streak,1999,"Martin Lawrence, Luke Wilson, Peter Greene",Les Mayfield,Comedy
Bogus,1996,"Whoopi Goldberg, Gérard Depardieu, Haley Joel Osment",Norman Jewison,Comedy
Bone,1972,"Yaphet Kotto, Andrew Duggan, Joyce Van Patten",Larry Cohen,Comedy
Boomerang,1992,"Eddie Murphy, Robin Givens, Halle Berry",Reginald Hudlin,Comedy
Booty Call,1997,"Jamie Foxx, Tommy Davidson, Vivica A. Fox",Jeff Pollack,Comedy
Breakin' All the Rules,2004,"Jamie Foxx, Gabrielle Union, Morris Chestnut",Daniel Taplitz,Comedy
Brewster's Millions,1985,"Richard Pryor, John Candy, Lonette McKee",Walter Hill,Comedy
Bringing Down the House,2003,"Steve Martin, Queen Latifah, Eugene Levy",Adam Shankman,Comedy
Brown Sugar,2002,"Taye Diggs, Sanaa Lathan, Mos Def",Rick Famuyiwa,Comedy
Buck and the Preacher,1972,"Sidney Poitier, Harry Belafonte, Ruby Dee",Sidney Poitier,Comedy
Bugged!,1997,"Priscilla K. Basque, Ronald K. Armstrong, Jeff Lee",Ronald K. Armstrong,Comedy
Burlesque in Harlem,1954,"Dewey ‘Pigmeat’ Markham, Dick Barrow, Jo Jo Adams",William Alexander,Comedy
Bustin' Loose,1981,"Richard Pryor, Cicely Tyson, Ángel Ramírez",Oz Scott,Comedy
Call Me Claus,2001,"Whoopi Goldberg, Nigel Hawthorne, Brian Stokes Mitchell",Peter Werner,Comedy
Car Wash,1976,"Richard Pryor, Franklyn Ajaye, Darrow Igus",Michael Schultz,Comedy
Carbon Copy,1981,"George Segal, Susan Saint James, Jack Warden",Michael Schultz,Comedy
Catfish in Black Bean Sauce,1999,"Chi Muoi Lo, Sanaa Lathan, Paul Winfield",Chi Muoi Lo,Comedy
CB4: The Movie,1993,"Chris Rock, Allen Payne, Deezer D",Tamra Davis,Comedy
Class Act,1992,"Christopher Reid, Christopher Martin, Andre Rosey Brown",Randall Miller,Comedy
Claudine,1974,"Diahann Carroll, James Earl Jones, Lawrence Hilton-Jacobs",John Berry,Comedy
College Road Trip,2008,"Raven-Symoné, Martin Lawrence, Kym Whitley",Roger Kumble,Comedy
Come Back Charleston Blue,1972,"Godfrey Cambridge, Raymond St. Jacques, Peter De Anda",Mark Warren,Comedy
Coming to America,1988,"Eddie Murphy, Arsenio Hall, James Earl Jones",John Landis,Comedy
Cool Runnings,1993," John Candy, Leon, Doug E. Doug", Jon Turteltaub,Comedy
Cooley High,1975,"Glynn Turman, Lawrence Hilton-Jacobs, Garrett Morris",Michael Schultz,Comedy
"Corrina, Corrina",1994,"Ray Liotta, Whoopi Goldberg, Tina Majorino",Jessie Nelson,Comedy
Cotton Comes to Harlem,1970,"Godfrey Cambridge, Raymond St. Jacques, Calvin Lockhart",Ossie Davis,Comedy
Critical Condition,1987,"Richard Pryor, Rachel Ticotin, Rubén Blades",Michael Apted,Comedy
Crooklyn,1994,"Alfre Woodard, Delroy Lindo, David Patrick Kelly",Spike Lee,Comedy
Daddy Day Camp,2007,"Cuba Gooding Jr., Lochlyn Munro, Richard Gant",Fred Savage,Comedy
Dance Fu,2011,"Kel Mitchell, Cedric the Entertainer, Kat Graham",Cedric the Entertainer,Comedy
Darktown Strutters,1975,"Trina Parks, Edna Richardson, Bettye Sweet",William Witney,Comedy
"David E. Talbert He Say, She Say But What Does God Say?",2004,"Clifton Powell, N’Bushe Wright, Thomas A. Ford",David E. Talbert,Comedy
Death at a Funeral,2010,"Chris Rock, Martin Lawrence, Keith David",Neil LaBute,Comedy
Deliver Us from Eva,2003,"Gabrielle Union, LL Cool J, Essence Atkins",Gary Hardwick,Comedy
Diary of a Mad Black Woman,2005,"Kimberly Elise, Steve Harris, Tyler Perry",Darren Grant,Comedy
Diary of a Tired Black Man,2008,"Jimmy Jean-Louis, Paula Lema, Tim Alexander",Tim Alexander,Comedy
Dirty Laundry,2006,"Rockmond Dunbar, Loretta Devine, Jenifer Lewis",Maurice Jamal,Comedy
Disorderlies,1987,"Darren Robinson, Damon Wimbley, Mark Morales",Michael Schultz,Comedy
Diva's Christmas Carol,2000,"Vanessa Williams, Rozonda ‘Chilli’ Thomas, John Taylor",Richard Schenkman,Comedy
Dolemite,1975,"Rudy Ray Moore, D’Urville Martin, Jerry Jones",D'Urville Martin,Comedy
Don't Be a Menace to South Central While Drinking Your Juice in the Hood,1996,"Shawn Wayans, Marlon Wayans, Keenen Ivory Wayans",Paris Barclay,Comedy
Don't Play Us Cheap,1973,"Thomas Anderson, Jay Van Leer, Robert Dunn",Melvin Van Peebles,Comedy
Double Deal,1939,"Monte Hawley, Jeni Le Gon, Edward Thompson",Arthur Dreifuss,Comedy
Double Take,2001,"Orlando Jones, Eddie Griffin, Gary Grubbs",George Gallo,Comedy
Double Wedding,2010,"Tamera Mowry-Housley, Tia Mowry-Hardrict, O.T. Fagbenle",Craig Pryce,Comedy
Down to Earth,2001,"Chris Rock, Regina King, Chazz Palminteri","Chris Weitz, Paul Weitz",Comedy
Dr. Doolittle,1998,"Eddie Murphy, Peter Boyle, Ossie Davis",Betty Thomas,Comedy
Dr. Doolittle 2,2001,"Eddie Murphy, Cedric the Entertainer, Kristen Wilson",Steve Carr,Comedy
Dr. Doolittle 3,2006,"Kristen Wilson, Tara Wilson, Kyla Pratt",Rich Thorne,Comedy
Driving Miss Daisy,1989,"Morgan Freeman, Jessica Tandy, Dan Aykroyd",Bruce Beresford,Comedy
Drumline,2002,"Nick Cannon, Zoe Saldana, Orlando Jones",Charles Stone III,Comedy
Dysfunctional Friends,2012,"Stacey Dash, Reagan Gomez-Preston, Wesley Jonathan",Corey Grant,Comedy
Eddie,1996,"Whoopi Goldberg, Frank Langella, Dennis Farina",Steve Rash,Comedy
Fat Albert,2004,"Kenan Thompson, Kyla Pratt, Omarion Grandberry",Joel Zwick,Comedy
Fear of a Black Hat,1993,"Larry B. Scott, Mark Christopher Lawrence, Rusty Cundieff",Rusty Cundieff,Comedy
Fish that Saved Pittsburgh,1979,"Julius Erving, Jonathan Winters, Meadowlark Lemon",Gilbert Moses,Comedy
Five on the Black Hand Side,1973,"Godfrey Cambridge, Clarice Taylor, Leonard Jackson",Oscar Williams,Comedy
Foolish,1999,"Eddie Griffin, Master P, Amie Petersen",Dave Meyers,Comedy
For Love of Ivy,1968,"Sidney Poitier, Abbey Lincoln, Beau Bridges",Daniel Mann,Comedy
Foxy Brown,1974,"Pam Grier, Antonio Fargas, Peter Brown",Jack Hill,Comedy
Friday,1995,"Ice Cube, Chris Tucker, Nia Long",F. Gary Gray,Comedy
Friday After Next,2002,"Ice Cube, Mike Epps, John Witherspoon",Marcus Raboy,Comedy
Getting Played,2006,"Vivica A. Fox, Bill Bellamy, Carmen Electra",David Silberg,Comedy
Ghost Dad,1990,"Bill Cosby, Kimberly Russell, Denise Nicholas",Sidney Poitier,Comedy
Girl 6,1996,"Theresa Randle, Isaiah Washington, Spike Lee",Spike Lee,Comedy
Glory Road,2006,"Josh Lucas, Derek Luke, Austin Nichols",James Gartner,Comedy
Good Burger,1997,"Kel Mitchell, Kenan Thompson, Sinbad",Brian Robbins,Comedy
Good Deeds,2012,"Tyler Perry, Gabrielle Union, Thandie Newton",Tyler Perry,Comedy
Good Fences,2003,"Danny Glover, Whoopi Goldberg, Zachary Simmons Glover",Ernest R. Dickerson,Comedy
Greased Lightning,1977,"Richard Pryor, Beau Bridges, Pam Grier",Michael Schultz,Comedy
Gridlock'd,1997,"Tupac Shakur, Tim Roth, Thandie Newton",Vondie Curtis-Hall,Comedy
Guess Who,2005,"Ashton Kutcher, Bernie Mac, Zoe Saldana",Kevin Rodney Sullivan,Comedy
Hangin' with the Homeboys,1991,"Doug E. Doug, Mario Joyner, John Leguizamo",Joseph B. Vasquez,Comedy
Harlem Nights,1989,"Eddie Murphy, Richard Pryor, Redd Foxx",Eddie Murphy,Comedy
Hav Plenty,1997,"Christopher Scott Cherot, Chenoa Maxwell, Tammi Katherine Jones",Christopher Scott Cherot,Comedy
Head of State,2003,"Chris Rock, Bernie Mac, Lynn Whitfield",Chris Rock,Comedy
Heart Condition,1990,"Bob Hoskins, Denzel Washington, Chloe Webb",James D. Parriott,Comedy
Hollywood Shuffle,1987,"Robert Townsend, Craigus R. Johnson, Helen Martin",Robert Townsend,Comedy
Homie Spumoni,2006,"Donald Faison, Jamie-Lynn Sigler, Whoopi Goldberg",Mike Cerrone,Comedy
Hot Potato,1976,"Jim Kelly, George Memmoli, Geoffrey Binney",Oscar Williams,Comedy
House Party,1990,"Christopher Reid, Robin Harris, Christopher Martin",Reginald Hudlin,Comedy
House Party 2,1991,"Christopher Reid, Christopher Martin, Martin Lawrence","George Jackson, Doug McHenry",Comedy
House Party 3,1994,"Christopher Reid, Christopher Martin, David Edwards",Eric Meza,Comedy
How High,2001,"Method Man, Redman, Obba Babatundé",Jesse Dylan,Comedy
I Can Do Bad All By Myself,2009,"Tyler Perry, Taraji P. Henson, Adam Rodriguez",Tyler Perry,Comedy
I Got the Hook Up,1998,"Master P, Anthony Johnson, Gretchen Palmer",Michael Martin,Comedy
I Think I Love My Wife,2007,"Chris Rock, Kerry Washington, Gina Torres",Chris Rock,Comedy
Imagine That,2009,"Eddie Murphy, Thomas Haden Church, Yara Shahidi",Karey Kirkpatrick,Comedy
I'm Gonna Git You Sucka,1988,"Keenen Ivory Wayans, Bernie Casey, Antonio Fargas",Keenen Ivory Wayans,Comedy
Jackie's Back,1999,"Jenifer Lewis, Tim Curry, T.V. Blake",Robert Townsend,Comedy
"Jo Jo Dancer, Your Life is Calling",1986,"Richard Pryor, Debbie Allen, Art Evans",Richard Pryor,Comedy
Johnson Family Vacation,2004,"Cedric the Entertainer, Shannon Elizabeth, Bow Wow",Christopher Erskin,Comedy
Juke Joint,1947,"Spencer Williams, July Jones, Inez Newell",Spencer Williams,Comedy
Jump In!,2007,"Corbin Bleu, Keke Palmer, David Reivers",Paul Hoen,Comedy
Jumping the Broom,2011,"Paula Patton, Laz Alonso, Angela Bassett",Salim Akil,Comedy
Just Wright,2010,"Queen Latifah, Common, Paula Patton",Sanaa Hamri,Comedy
Juwanna Mann,2002,"Miguel A. Núñez Jr., Christopher Simmons, Vivica A. Fox",Jesse Vaughan,Comedy
Kingdom Come,2001,"LL Cool J, Jada Pinkett Smith, Vivica A. Fox",Doug McHenry,Comedy
Krush Groove,1985,"Sheila E., Joseph Simmons, Darryl McDaniels",Michael Schultz,Comedy
Last Holiday,2006,"Queen Latifah, LL Cool J, Timothy Hutton",Wayne Wang,Comedy
Let's Do It Again,1975,"Sidney Poitier, Bill Cosby, Calvin Lockhart",Sidney Poitier,Comedy
Life,1999,"Eddie Murphy, Martin Lawrence, Obba Babatundé",Ted Demme,Comedy
Life-Size,2000,"Lindsay Lohan, Jere Burns, Anne Marie DeLuise",Mark Rosman,Comedy
Like Mike,2002,"Bow Wow, Jonathan Lipnicki, Morris Chestnut",John Schultz,Comedy
Like Mike 2: Streetball,2006,"Jascha Washington, Kel Mitchell, Michael Beach",David Nelson,Comedy
Lilies of the Field,1963,"Sidney Poitier, Lilia Skala, Lisa Mann",Ralph Nelson,Comedy
Little Man,2006,"Shawn Wayans, Marlon Wayans, Kerry Washington",Keenen Ivory Wayans,Comedy
Livin' Large!,1991,"Terrence ‘T.C.’ Carson, Lisa Arrindell Anderson, Blanche Baker",Michael Schultz,Comedy
Lord All Men Can't Be Dogs,2011,"Vivica A. Fox, Christian Keyes, Elise Neal",T.J. Hemphill,Comedy
Lottery Ticket,2010,"Bow Wow, Brandon T. Jackson, Naturi Naughton",Erik White,Comedy
Love Don't Cost a Thing,2003,"Nick Cannon, Christina Milian, Jordan Burg",Troy Byer,Comedy
Made in America,1993,"Whoopi Goldberg, Ted Danson, Will Smith",Richard Benjamin,Comedy
Madea Goes to Jail,2009,"Tyler Perry, Keshia Knight Pulliam, Derek Luke",Tyler Perry,Comedy
Madea's Big Happy Family,2011,"Tyler Perry, Loretta Devine, Bow Wow",Tyler Perry,Comedy
Madea's Family Reunion,2006,"Tyler Perry, Blair Underwood, Lynn Whitfield",Tyler Perry,Comedy
Madea's Witness Protection,2012,"Tyler Perry, Eugene Levy, Denise Richards",Tyler Perry,Comedy
Major Payne,1995,"Damon Wayans, Michael Ironside, Scott Bigalow",Nick Castle,Comedy
Masquerade,2000,"Simbi Khali, Cress Williams, Kellita Smith",Roy Campanella II,Comedy
Meet Dave,2008,"Eddie Murphy, Elizabeth Banks, Gabrielle Union",Brian Robbins,Comedy
Meet the Browns,2008,"Tamela J. Mann, Angela Bassett, Tyler Perry",Tyler Perry,Comedy
Men in Black,1997,"Tommy Lee Jones, Will Smith, Linda Fiorentino",Barry Sonnenfeld,Comedy
Men in Black II,2002,"Tommy Lee Jones, Will Smith, Rip Torn",Barry Sonnenfeld,Comedy
Mississippi Masala,1991,"Denzel Washington, Sarita Choudhury, Roshan Seth",Mira Nair,Comedy
Mistaken Identity aka Murder with Music,1941,"Bob Howard, Milton Williams, Nellie Hill",George P. Quigley,Comedy
Mother Jugs and Speed,1976,"Bill Cosby, Raquel Welch, Harvey Keitel",Peter Yates,Comedy
Moving,1988,"Richard Pryor, Beverly Todd, Stacey Dash",Alan Metter,Comedy
Mo' Money,1992,"Damon Wayans, Stacey Dash, Marlon Wayans",Peter MacDonald,Comedy
Mr. 3000,2004,"Bernie Mac, Angela Bassett, Michael Rispoli",Charles Stone III,Comedy
National Security,2003,"Martin Lawrence, Steve Zahn, Colm Feore",Dennis Dugan,Comedy
Next Friday,2000,"Ice Cube, Mike Epps, Justin Pierce",Steve Carr,Comedy
Nora's Hair Salon,2004,"Tatyana Ali, Kristian Bernard, Bobby Brown",Jerry LaMothe,Comedy
Note to Self,2012,"Christian Keyes, Richard T. Jones, Chidi Ajufo",Trey Haley,Comedy
Old Dracula,1975,"David Niven, Teresa Graves, Peter Bayliss",Clive Donner,Comedy
Our Family Wedding,2010,"America Ferrera, Forest Whitaker, Carlos Mencia",Rick Famuyiwa,Comedy
Paradise in Harlem,1939,"Frank H. Wilson, Mamie Smith, Norman Astwood",Joseph Seiden,Comedy
Perfect Combination,2010,"Christian Keyes, Tiffany Hines, Angell Conwell",Trey Haley,Comedy
Perfect Holiday,2007,"Gabrielle Union, Morris Chestnut, Queen Latifah",Lance Rivera,Comedy
Petey Wheatstraw,1977,"Rudy Ray Moore, Jimmy Lynch, Leroy Daniels",Cliff Roquemore,Comedy
Phat Beach,1996,"Jermaine ‘Huggy’ Hopkins, Brian Hooks, Claudia Kaleem",Doug Ellin,Comedy
Phat Girlz,2006,"Mo’Nique, Kendra C. Johnson, Jimmy Jean-Louis",Nnegest Likké,Comedy
Pootie Tang,2001,"Chris Rock, Lance Crouther, J.B. Smoove",Louis C.K.,Comedy
Preaching to the Choir,2005,"Billoah Greene, Darien Sills-Evans, Novella Nelson",Charles Randolph-Wright,Comedy
Purlie Victorious aka Gone Are the Days,1963,"Ossie Davis, Ruby Dee, Godfrey Cambridge",Nicholas Webster,Comedy
Putney Swope,1969,"Arnold Johnson, Stan Gottlieb, Allen Garfield",Robert Downey Sr.,Comedy
Rage in Harlem,1991,"Forest Whitaker, Gregory Hines, Robin Givens",Bill Duke,Comedy
Rebound,2005,"Martin Lawrence, Megan Mullally, Breckin Meyer",Steve Carr,Comedy
Ride,1998,"Melissa De Sousa, John Witherspoon, Cedric the Entertainer",Millicent Shelton,Comedy
Roll Bounce,2005,"Bow Wow, Nick Cannon, Meagan Good",Malcolm D. Lee,Comedy
Rush Hour,1998,"Jackie Chan, Chris Tucker, Ken Leung",Brett Ratner,Comedy
Rush Hour 2,2001,"Jackie Chan, Chris Tucker, John Lone",Brett Ratner,Comedy
Rush Hour 3,2007,"Jackie Chan, Chris Tucker, Max von Sydow",Brett Ratner,Comedy
Sankofa,1993,"Kofi Ghanaba, Oyafunmike Ogunlano, Alexandra Duah",Haile Gerima,Comedy
School Daze,1988,"Laurence Fishburne, Giancarlo Esposito, Tisha Campbell-Martin",Spike Lee,Comedy
"See No Evil, Hear No Evil",1989,"Richard Pryor, Gene Wilder, Joan Severance",Arthur Hiller,Comedy
Seventeen Again,2000,"Tia Mowry-Hardrict, Tamera Mowry-Housley, Mark Taylor",Jeffrey W. Byrd,Comedy
She Hate Me,2004,"Anthony Mackie, Kerry Washington, Ellen Barkin",Spike Lee,Comedy
She's Gotta Have It,1986,"Tracy Camilla Johns, Tommy Redmond Hicks, John Canada Terrell",Spike Lee,Comedy
Silver Streak,1976,"Gene Wilder, Richard Pryor, Jill Clayburgh",Arthur Hiller,Comedy
Sister Act,1992,"Whoopi Goldberg, Maggie Smith, Kathy Najimy",Emile Ardolino,Comedy
Sister Act 2,1993,"Whoopi Goldberg, Kathy Najimy, Maggie Smith",Bill Duke,Comedy
Snow Dogs,2002,"Cuba Gooding Jr., James Coburn, Sisqó",Brian Levant,Comedy
Some Kind of Hero,1982,"Richard Pryor, Margot Kidder, Ray Sharkey",Michael Pressman,Comedy
Something New,2006,"Sanaa Lathan, Simon Baker, Golden Brooks",Sanaa Hamri,Comedy
Soul Food,1997,"Vanessa Williams, Vivica A. Fox, Nia Long",George Tillman Jr.,Comedy
Soul Men,2008,"Samuel L. Jackson, Bernie Mac, Sharon Leal",Malcolm D. Lee,Comedy
Soul Plane,2004,"Dwayne Adway, Snoop Dogg, Tom Arnold", Jessy Terrero,Comedy
Space Jam,1996,"Michael Jordan, Wayne Knight, Theresa Randle",Joe Pytka,Comedy
Sprung,1997,"Tisha Campbell-Martin, Rusty Cundieff, Paula Jai Parker",Rusty Cundieff,Comedy
Stir Crazy,1980,"Gene Wilder, Richard Pryor, Georg Stanford Brown",Sidney Poitier,Comedy
Strictly Business,1991,"Tommy Davidson, Joseph C. Phillips, Anne-Marie Johnson",Kevin Hooks,Comedy
Sunday Sinners,1940,"Earl Sydnor, Norman Astwood, Edna Mae Harris",Arthur Dreifuss,Comedy
Tap,1989,"Gregory Hines, Suzzanne Douglas, Sammy Davis Jr.",Nick Castle,Comedy
Thank God It’s Friday,1978,"Donna Summer, Valerie Landsburg, Terri Nunn",Robert Klane,Comedy
The Associate,1996,"Whoopi Goldberg, Dianne Wiest, Eli Wallach",Donald Petrie,Comedy
The Best Man,1999,"Taye Diggs, Nia Long, Morris Chestnut",Malcolm D. Lee,Comedy
The Breaks,1999,"Isaiah Barnes, Paula Bel, Paul Benjamin",Eric Meza,Comedy
The Brother From Another Planet,1984," Joe Morton, Daryl Edwards, Rosanna Carter",John Sayles,Comedy
The Brothers,2001,"Morris Chestnut, Shemar Moore, D.L. Hughley",Gary Hardwick,Comedy
The Cheetah Girls,2003,"Raven-Symoné, Adrienne Bailon, Kiely Williams",Oz Scott,Comedy
The Cheetah Girls 2,2006,"Raven-Symoné, Adrienne Bailon, Sabrina Bryan",Kenny Ortega,Comedy
The Cheetah Girls' One World,2008,"Adrienne Bailon, Sabrina Bryan, Kiely Williams",Paul Hoen,Comedy
The Cookout,2004,"Quran Pender, Jenifer Lewis, Ja Rule",Lance Rivera,Comedy
The Distinguished Gentleman,1992,"Eddie Murphy, Lane Smith, Sheryl Lee Ralph",Jonathan Lynn,Comedy
The Fighting Temptations,2003,"Cuba Gooding Jr., Beyoncé Knowles, Mike Epps",Jonathan Lynn,Comedy
The Fish that Saved Pittsburgh,1979,"Julius Erving, Jonathan Winters, Meadowlark Lemon",Gilbert Moses,Comedy
The Gods Must Be Crazy,1980,"N!xau, Marius Weyers, Sandra Prinsloo",Jamie Uys,Comedy
The Golden Child,1986,"Eddie Murphy, J.L. Reate, Charles Dance",Michael Ritchie,Comedy
The Great White Hype,1996,"Samuel L. Jackson, Jeff Goldblum, Damon Wayans",Reginald Hudlin,Comedy
The Human Tornado,1976,"Rudy Ray Moore, Lady Reed, Jimmy Lynch",Cliff Roquemore,Comedy
The Inkwell,1994,"Larenz Tate, Joe Morton, Suzzanne Douglas",Matty Rich,Comedy
The Ladies Man,2000,"Tim Meadows, Karyn Parsons, Billy Dee Williams",Reginald Hudlin,Comedy
The Landlord,1970,"Beau Bridges, Lee Grant, Diana Sands",Hal Ashby,Comedy
The Last Dragon,1985,"Taimak, Vanity, Christopher Murney",Michael Schultz,Comedy
The Longshots,2008,"Ice Cube, Keke Palmer, Tasha Smith",Fred Durst,Comedy
The Love Section,2013,"Mekhi Phifer, Lawrence B. Adisa, Brian Hooks",Ronnie Warner,Comedy
The Meteor Man,1993,"Robert Townsend, Marla Gibbs, Eddie Griffin",Robert Townsend,Comedy
The Monkey Hustle,1976,"Yaphet Kotto, Kirk Calloway, Thomas Carter",Arthur Marks,Comedy
The Nutty Professor,1996,"Eddie Murphy, Jada Pinkett Smith, James Coburn",Tom Shadyac,Comedy
The Old Settler,2001,"Phylicia Rashad, Debbie Allen, Bumper Robinson",Debbie Allen,Comedy
The Perfect Gift,2011,"Ruben Studdard, Golden Brooks, Buddy Lewis",Alvin Moore Jr.,Comedy
The Players Club,1998,"LisaRaye, Dick Anthony Williams, Judyann Elder",Ice Cube,Comedy
The Preacher’s Wife,1996,"Denzel Washington, Whitney Houston, Courtney B. Vance",Penny Marshall,Comedy
The Proud Family Movie,2005,"Kyla Pratt, Tommy Davidson, Paula Jai Parker",Bruce W. Smith,Comedy
The Skin Game,1971,"James Garner, Louis Gossett Jr., Susan Clark",Paul Bogart,Comedy
The Thing with Two Heads,1972,"Roosevelt Grier, Ray Milland, Don Marshall",Lee Frost,Comedy
The Toy,1982,"Richard Pryor, Jackie Gleason, Ned Beatty",Richard Donner,Comedy
The Wash,2001,"Dr. Dre, Snoop Dogg, Anthony Albano",DJ Pooh,Comedy
The Wood,1999,"Elayn J. Taylor, Omar Epps, Richard T. Jones",Rick Famuyiwa,Comedy
Think Like a Man,2012,"Chris Brown, Gabrielle Union, Kevin Hart",Tim Story,Comedy
This Christmas,2007,"Regina King, Columbus Short, Delroy Lindo",Preston A. Whitmore II,Comedy
Three Can Play That Game,2007,"Vivica A. Fox, Jason George, Jazsmin Lewis",Samad Davis,Comedy
Three Strikes,2000,"Brian Hooks, N’Bushe Wright, Faizon Love",DJ Pooh,Comedy
Trading Places,1983,"Eddie Murphy, Dan Aykroyd, Ralph Bellamy",John Landis,Comedy
Trippin’,1999,"Deon Richmond, Donald Faison, Guy Torry",David Raynr,Comedy
True Identity,1991,"Lenny Henry, Frank Langella, Charles Lane",Charles Lane,Comedy
Twitches,2005,"Tia Mowry-Hardrict, Tamera Mowry-Housley, Kristen Wilson",Stuart Gillard,Comedy
Two Can Play that Game,2001,"Vivica A. Fox, Morris Chestnut, Anthony Anderson",Mark Brown,Comedy
Under the Cherry Moon,1986,"Prince, Jerome Benton, Kristin Scott Thomas",Prince,Comedy
Undercover Brother,2002,"Eddie Griffin, Denise Richards, Aunjanue Ellis",Malcolm D. Lee,Comedy
Uptown Saturday Night,1974,"Sidney Poitier, Bill Cosby, Harry Belafonte",Sidney Poitier,Comedy
Vampire in Brooklyn,1995,"Eddie Murphy, Angela Bassett, Allen Payne",Wes Craven,Comedy
Waiting to Exhale,1995,"Whitney Houston, Angela Bassett, Loretta Devine",Forest Whitaker,Comedy
Watermelon Man,1970,"Godfrey Cambridge, Estelle Parsons, Howard Caine",Melvin Van Peebles,Comedy
Welcome Home Roscoe Jenkins,2008,"Martin Lawrence, Louis C.K., James Earl Jones",Malcolm D. Lee,Comedy
Which Way is Up?,1977,"Richard Pryor, Lonette McKee, Margaret Avery",Michael Schultz,Comedy
White Chicks,2004,"Marlon Wayans, Shawn Wayans, Busy Philipps",Keenen Ivory Wayans,Comedy
White Men Can’t Jump,1992,"Wesley Snipes, Woody Harrelson, Rosie Perez",Ron Shelton,Comedy
Who's The Man?,1993,"Ed Lover, Doctor Dré, Badja Djola",Ted Demme,Comedy
Why Did I Get Married Too?,2010,"Janet Jackson, Tyler Perry, Jill Scott",Tyler Perry,Comedy
Why Did I Get Married?,2007,"Tyler Perry, Janet Jackson, Sharon Leal",Tyler Perry,Comedy
Woo,1998,"Jada Pinkett Smith, Tommy Davidson, Duane Martin",Daisy von Scherler Mayer,Comedy
You Got Served,2004,"Omarion Grandberry, J-Boog, Raz B",Chris Stokes,Comedy