Title,Genre,Year,Director,Stars,Worldwide,Domestic,%,Foreign,%.1
Eve's Bayou,Drama,1997,Kasi Lemmons,"Samuel L. Jackson, Jurnee Smollett-Bell, Meagan Good","$14,842,388","$14,842,388",100%,-,-
Finding Forrester,Drama,2000,Gus Van Sant,"Sean Connery, Rob Brown, F. Murray Abraham","$80,049,764","$51,804,714",64.7%,"$28,245,050",35.3%
Flight,Drama,2012,Robert Zemeckis,"Denzel Washington, Nadine Velazquez, Don Cheadle","$161,772,375","$93,772,375",58%,"$68,000,000",42%
Ganja and Hess,Drama,1973,Bill Gunn,"Duane Jones, Marlene Clark, Bill Gunn","$21,197","$21,197",100%,-,-
Get on the Bus,Drama,1996,Spike Lee,"Ossie Davis, Charles S. Dutton, Andre Braugher","$5,754,249","$5,754,249",100%,-,-
Ghosts of Mississippi,Drama,1996,Rob Reiner,"Alec Baldwin, James Woods, Whoopi Goldberg","$13,323,144","$13,323,144",100%,-,-
Graffiti Bridge,Drama,1990,Prince,"Prince, Morris Day, Ingrid Chavez","$4,562,778","$4,562,778",100%,-,-
He Got Game,Drama,1998,Spike Lee,"Denzel Washington, Milla Jovovich, Ray Allen","$21,567,853","$21,567,853",100%,-,-
Hoodlum,Drama,1997,Bill Duke,"Laurence Fishburne, Tim Roth, Vanessa Williams","$23,499,102","$23,499,102",100%,-,-
Hoop Dreams,Drama,1994,Steve James,"William Gates, Arthur Agee, Emma Gates","$7,830,611","$7,830,611",100%,-,-
Hotel Rwanda,Drama,2004,Terry George,"Don Cheadle, Sophie Okonedo, Joaquin Phoenix","$33,882,243","$23,530,892",69.4%,"$10,351,351",30.6%
Idlewild,Drama,2006,Bryan Barber,"Big Boi, Terrence Howard, André Benjamin","$12,643,027","$12,571,185",99.4%,"$71,842",0.6%
Jason's Lyric,Drama,1994,Doug McHenry,"Allen Payne, Jada Pinkett Smith, Bokeem Woodbine","$20,851,521","$20,851,521",100%,-,-
John Q,Drama,2002,Nick Cassavetes,"Denzel Washington, Robert Duvall, Gabriela Oltean","$102,244,770","$71,756,802",70.2%,"$30,487,968",29.8%
Juice,Drama,1992,Ernest R. Dickerson,"Omar Epps, Tupac Shakur, Jermaine ‘Huggy’ Hopkins","$20,146,880","$20,146,880",100%,-,-
Killer of Sheep,Drama,1979,Charles Burnett,"Henry G. Sanders, Kaycee Moore, Charles Bracy","$416,509","$404,508",97.1%,"$12,001",2.9%
Kings of the Evening,Drama,2008,Andrew P. Jones,"Tyson Beckford, Lynn Whitfield, Glynn Turman","$99,270","$99,270",100%,-,-
Lakeview Terrace,Drama,2008,Neil LaBute,"Samuel L. Jackson, Patrick Wilson, Kerry Washington","$44,655,002","$39,263,506",87.9%,"$5,391,496",12.1%
Lean on Me,Drama,1989,John G. Avildsen,"Morgan Freeman, Beverly Todd, Robert Guillaume","$31,906,454","$31,906,454",100%,-,-
Lean on Me,Action,1989,John G. Avildsen,"Morgan Freeman, Beverly Todd, Robert Guillaume","$31,906,454","$31,906,454",100%,-,-
Light It Up,Drama,1999,Craig Bolotin,"Usher Raymond, Forest Whitaker, Rosario Dawson","$5,985,690","$5,985,690",100%,-,-
Losing Isaiah,Drama,1995,Stephen Gyllenhaal,"Jessica Lange, Halle Berry, David Strathairn","$7,603,766","$7,603,766",100%,-,-
48 Hrs.,Action,1982,Walter Hill,"Nick Nolte, Eddie Murphy, Annette O’Toole","$78,868,508","$78,868,508",100%,-,-
Alex Cross,Action,2012,Rob Cohen,"Tyler Perry, Matthew Fox, Rachel Nichols","$34,618,867","$25,888,412",74.8%,"$8,730,455",25.2%
Blade II,Action,2002,Guillermo del Toro,"Wesley Snipes, Kris Kristofferson, Ron Perlman","$155,010,032","$82,348,319",53.1%,"$72,661,713",46.9%
Crossover,Action,2006,Preston A. Whitmore II,"Anthony Mackie, Wesley Jonathan, Wayne Brady","$7,009,668","$7,009,668",100%,-,-
Deep Cover,Action,1992,Bill Duke,"Laurence Fishburne, Jeff Goldblum, Lira Angel","$16,639,799","$16,639,799",100%,-,-
"I, Robot",Action,2004,Alex Proyas,"Will Smith, Bridget Moynahan, Bruce Greenwood","$353,133,898","$144,801,023",41%,"$208,332,875",59%
Lethal Weapon,Action,1987,Richard Donner,"Mel Gibson, Danny Glover, Gary Busey","$65,207,127","$65,207,127",100%,-,-
Miracle at St. Anna,Action,2008,Spike Lee,"Derek Luke, Michael Ealy, Laz Alonso","$9,333,654","$7,919,117",84.8%,"$1,414,537",15.2%
Original Gangstas,Action,1996,Larry Cohen,"Fred Williamson, Jim Brown, Pam Grier","$3,718,087","$3,718,087",100%,-,-
Ricochet,Action,1991,Russell Mulcahy,"Denzel Washington, John Lithgow, Ice-T","$21,756,163","$21,756,163",100%,-,-
Rosewood,Action,1997,John Singleton,"Jon Voight, Ving Rhames, Don Cheadle","$13,130,349","$13,130,349",100%,-,-
Safe House,Action,2012,Daniel Espinosa,"Denzel Washington, Ryan Reynolds, Robert Patrick","$208,076,205","$126,373,434",60.7%,"$81,702,771",39.3%
Set It Off,Action,1996,F. Gary Gray,"Jada Pinkett Smith, Queen Latifah, Vivica A. Fox","$36,461,139","$36,461,139",100%,-,-
Sugar Hill,Action,1974,Paul Maslansky,"Marki Bey, Robert Quarry, Don Pedro Colley","$18,225,518","$18,225,518",100%,-,-
Surviving the Game,Action,1994,Ernest R. Dickerson,"Rutger Hauer, Ice-T, Charles S. Dutton","$7,727,256","$7,727,256",100%,-,-
The Book of Eli,Action,2010,"Albert Hughes, Allen Hughes","Denzel Washington, Mila Kunis, Ray Stevenson","$157,107,755","$94,835,059",60.4%,"$62,272,696",39.6%
The Mighty Quinn,Action,1989,Carl Schenkel,"Denzel Washington, Robert Townsend, James Fox","$4,557,214","$4,557,214",100%,-,-
The Siege,Action,1998, Edward Zwick,"Denzel Washington, Bruce Willis, Annette Bening","$116,672,912","$40,981,289",35.1%,"$75,691,623",64.9%
Turn It Up,Action,2000,Robert Adetuyi,"Pras, Ja Rule, Jason Statham","$1,247,949","$1,247,949",100%,-,-
Undisputed,Action,2002,Walter Hill,"Wesley Snipes, Ving Rhames, Peter Falk","$14,946,150","$12,764,657",85.4%,"$2,181,493",14.6%
Undisputed 2: Last Man Standing,Action,2006,Isaac Florentine,"Michael Jai White, Scott Adkins, Ben Cross","$1,361",-,-,"$1,361",100%
Undisputed 3: Redemption,Action,2010,Isaac Florentine,"Scott Adkins, Mykel Shannon Jenkins, Mark Ivanir","$282,548",-,-,"$282,548",100%
Virtuosity,Action,1995,Brett Leonard,"Denzel Washington, Russell Crowe, Kelly Lynch","$24,047,675","$24,047,675",100%,-,-
